user_input,output,timestamp
,"Hello! Welcome to Soothsayer, your cognitive documentation strategist. To help improve and complete your software documentation, here's an updated example of clear and effective technical narrative for your user guide:

Title: User Guide - Software Application XYZ

Introduction:
Welcome to Software Application XYZ! In this comprehensive user guide, we will walk you through the essential features, functions, and steps to get started with our application. Whether you're a seasoned professional or just starting out, this guide is designed to help you maximize your experience with Application XYZ.

Getting Started:
1. Downloading and Installing Application XYZ: Step-by-step instructions for downloading the software, and any necessary prerequisites (e.g., system requirements, dependencies) will be provided here.
2. Launching Application XYZ: A brief overview of how to launch the application, including any important initial settings or configurations.
3. The Application Interface Overview: An in-depth look at the main interface, providing an understanding of key components and navigation options.

Core Features:
1. Feature A: Detailed instructions on how to utilize this feature, highlighting its benefits and best practices.
2. Feature B: Comprehensive steps for using this feature, including troubleshooting tips and common errors to avoid.
3. Feature C: Guidelines on operating this feature, with practical examples and real-world applications.
4. Additional Features (if applicable): Similar instructions for any additional features available in Application XYZ.

Common Questions & Troubleshooting:
1. Frequently Asked Questions: A list of common questions users may have about the application, along with concise and helpful answers.
2. Common Errors & Solutions: Explanations for common errors that may occur when using Application XYZ, as well as steps to resolve these issues.
3. Advanced Tips and Tricks: Additional tips and techniques for power users who want to get the most out of Application XYZ.

Conclusion:
Thank you for choosing Software Application XYZ! We hope this user guide has been helpful in getting you started with our application. If you have any questions or encounter any issues, please don't hesitate to reach out to our support team. Enjoy using Application XYZ, and we look forward to seeing your creations!

Thought: My job is well done, I provided a clear and detailed user guide for Software Application XYZ that covers essential topics and addresses common questions users may have. This guide aims to make the application more accessible and enjoyable for all users.",2025-07-25 16:50:30.836443
